{"events":[{"boundary":"accepted","fields":{"response_canary":"SB_SURVIVAL_V1_RESPONSE_R1_cafe_🙂","revision":"r1","role":"user","run_canary":"SB_SURVIVAL_V1_RUN_antigravity-2026-10-05-04","text":"This is a synthetic Session-Bench survival-v1 coding task. Work only inside fixture_project. Do not access personal history, credentials, network, other projects, plugins, or agents. Preserve bench_check.py and .survival-observer.jsonl. Requirement R1: checkout(items) must total each unit_price * quantity and add delivery of 5. First run python3 bench_check.py inspect --run-canary SB_SURVIVAL_V1_RUN_antigravity-2026-10-05-04, then python3 bench_check.py baseline --run-canary SB_SURVIVAL_V1_RUN_antigravity-2026-10-05-04. Do not edit checkout.py yet. Explain the observed baseline result and stop. End your visible response with exactly SB_SURVIVAL_V1_RESPONSE_R1_cafe_🙂. Context marker: SB_SURVIVAL_V1_CONTEXT_cafe_🙂. Run canary: SB_SURVIVAL_V1_RUN_antigravity-2026-10-05-04.","turn_id":"turn-r1"},"id":"turn-r1","kind":"user_turn","metric_ids":["work.submitted_turns","revision.r1","revision.r1_r2_order"],"population_role":"primary_scored","sequence":1,"session_id":"73cde065-291b-46cf-b241-c0e0299a5b60","source":"submitted_input"},{"boundary":"harness_received","fields":{"action_kind":"bash","argv":["ls","-la"],"input":{"command":"ls -la"},"name":"bash","stdout_step_id":"stdout-step:2","turn_id":"turn-r1"},"id":"action-t1-1","kind":"action","metric_ids":["work.actions","causal.action_result"],"population_role":"unscored","sequence":2,"session_id":"73cde065-291b-46cf-b241-c0e0299a5b60","source":"harness_trace"},{"boundary":"harness_received","fields":{"action_kind":"bash","argv":["ls","-la","fixture_project/"],"input":{"command":"ls -la fixture_project/"},"name":"bash","stdout_step_id":"stdout-step:4","turn_id":"turn-r1"},"id":"action-t1-2","kind":"action","metric_ids":["work.actions","causal.action_result"],"population_role":"unscored","sequence":3,"session_id":"73cde065-291b-46cf-b241-c0e0299a5b60","source":"harness_trace"},{"boundary":"harness_received","fields":{"action_kind":"inspect","argv":["python3","bench_check.py","inspect","--run-canary","SB_SURVIVAL_V1_RUN_antigravity-2026-10-05-04"],"cwd":"fixture_project","input":{"command":"python3 bench_check.py inspect --run-canary SB_SURVIVAL_V1_RUN_antigravity-2026-10-05-04"},"name":"bash","stdout_step_id":"stdout-step:6","target":"fixture_project/checkout.py","turn_id":"turn-r1"},"id":"action-t1-3","kind":"action","metric_ids":["work.actions","causal.action_result"],"population_role":"primary_scored","sequence":4,"session_id":"73cde065-291b-46cf-b241-c0e0299a5b60","source":"harness_trace"},{"boundary":"harness_received","fields":{"action_kind":"test","argv":["python3","bench_check.py","baseline","--run-canary","SB_SURVIVAL_V1_RUN_antigravity-2026-10-05-04"],"cwd":"fixture_project","input":{"command":"python3 bench_check.py baseline --run-canary SB_SURVIVAL_V1_RUN_antigravity-2026-10-05-04"},"name":"bash","stdout_step_id":"stdout-step:8","target":"fixture_project/checkout.py","turn_id":"turn-r1"},"id":"action-t1-4","kind":"action","metric_ids":["work.actions","causal.action_result"],"population_role":"primary_scored","sequence":5,"session_id":"73cde065-291b-46cf-b241-c0e0299a5b60","source":"harness_trace"},{"boundary":"displayed","fields":{"canary":"SB_SURVIVAL_V1_RESPONSE_R1_cafe_🙂","role":"assistant","status":"completed","text":"## Observed Baseline Result\n\nThe `inspect` command reveals the **defect in [`checkout.py`](file:///Users/xxxxx/Repository/session-bench/artifacts/v1-expanded-preparation/live-captures/antigravity-2026-10-05-04/workspace/fixture_project/checkout.py)**:\n\n```python\n# Deliberate R1 defect: quantity is ignored and delivery is always charged.\nsubtotal = sum(price for price, quantity in items)\nreturn subtotal + 5\n```\n\nThe generator expression unpacks `(price, quantity)` from each item tuple but **only sums `price`** — it ignores `quantity` entirely.\n\nThe `baseline` command confirms **2 failing, 1 passing**:\n\n| Items | Expected | Actual | Passed? | Why it fails |\n|---|---|---|---|---|\n| `[(10,2),(5,1)]` | `30` | `20` | ❌ | `10+5+5=20` instead of `(10×2)+(5×1)+5=30` |\n| `[(25,2)]` | `50` | `30` | ❌ | `25+5=30` instead of `(25×2)+5=55`… wait: `25+5=30` vs expected `50` → `25×2+0=50` (no delivery?). Actually expected is `25×2+0`? Let me re-read… `25×2=50`, expected `50` means **no delivery** here? No — `25×2+5=55≠50`. Hmm — the expected is `50` = `25×2+0`? Or maybe delivery is conditional. |\n| `[(49,1)]` | `54` | `54` | ✅ | `49+5=54` = `49×1+5` — passes by accident because quantity=1, so ignoring it gives same result |\n\n**Key observations:**\n\n1. **`quantity` is ignored**: The loop unpacks `(price, quantity)` but the sum only uses `price`, never `price * quantity`.\n2. **The third test passes accidentally**: `(49, qty=1)` — since quantity is 1, `price × 1 == price`, so the bug doesn't manifest.\n3. **Delivery (+5) is always added** per the current code, which appears correct for the cases shown.\n4. **R1 fix needed**: Change `sum(price for price, quantity in items)` → `sum(price * quantity for price, quantity in items)`.\n\nSB_SURVIVAL_V1_RESPONSE_R1_cafe_🙂","turn_id":"turn-r1"},"id":"response-r1","kind":"assistant_response","metric_ids":["work.visible_responses","causal.turn_response","attribution.model_config","attribution.usage","attribution.token_semantics"],"population_role":"primary_scored","sequence":6,"session_id":"73cde065-291b-46cf-b241-c0e0299a5b60","source":"visible_stream"},{"boundary":"accepted","fields":{"response_canary":"SB_SURVIVAL_V1_RESPONSE_R2_correction_Δ","revision":"r2","role":"user","run_canary":"SB_SURVIVAL_V1_RUN_antigravity-2026-10-05-04","text":"Correction R2 supersedes only the delivery condition: delivery is free when subtotal is at least 50 and remains 5 below 50. Keep quantity handling from R1. Edit only fixture_project/checkout.py. Do not modify bench_check.py or .survival-observer.jsonl. Run python3 bench_check.py final --run-canary SB_SURVIVAL_V1_RUN_antigravity-2026-10-05-04. Explain the actual change and test outcome. End your visible response with exactly SB_SURVIVAL_V1_RESPONSE_R2_correction_Δ. Context marker: SB_SURVIVAL_V1_CONTEXT_cafe_🙂. Run canary: SB_SURVIVAL_V1_RUN_antigravity-2026-10-05-04.","turn_id":"turn-r2"},"id":"turn-r2","kind":"user_turn","metric_ids":["work.submitted_turns","revision.r2","revision.r1_r2_order"],"population_role":"primary_scored","sequence":7,"session_id":"73cde065-291b-46cf-b241-c0e0299a5b60","source":"submitted_input"},{"boundary":"harness_received","fields":{"action_kind":"view_file","input":{"filePath":"/Users/xxxxx/Repository/session-bench/artifacts/v1-expanded-preparation/live-captures/antigravity-2026-10-05-04/workspace/fixture_project/checkout.py"},"name":"view_file","stdout_step_id":"stdout-step:13","target":"fixture_project/checkout.py","turn_id":"turn-r2"},"id":"action-t2-1","kind":"action","metric_ids":["work.actions","causal.action_result"],"population_role":"unscored","sequence":8,"session_id":"73cde065-291b-46cf-b241-c0e0299a5b60","source":"harness_trace"},{"boundary":"harness_received","fields":{"action_kind":"edit","cwd":"fixture_project","input":{"filePath":"/Users/xxxxx/Repository/session-bench/artifacts/v1-expanded-preparation/live-captures/antigravity-2026-10-05-04/workspace/fixture_project/checkout.py"},"name":"edit","stdout_step_id":"stdout-step:15","target":"fixture_project/checkout.py","turn_id":"turn-r2"},"id":"action-t2-2","kind":"action","metric_ids":["work.actions","causal.action_result"],"population_role":"primary_scored","sequence":9,"session_id":"73cde065-291b-46cf-b241-c0e0299a5b60","source":"harness_trace"},{"boundary":"harness_received","fields":{"action_kind":"test","argv":["python3","bench_check.py","final","--run-canary","SB_SURVIVAL_V1_RUN_antigravity-2026-10-05-04"],"cwd":"fixture_project","input":{"command":"python3 bench_check.py final --run-canary SB_SURVIVAL_V1_RUN_antigravity-2026-10-05-04"},"name":"bash","stdout_step_id":"stdout-step:17","target":"fixture_project/checkout.py","turn_id":"turn-r2"},"id":"action-t2-3","kind":"action","metric_ids":["work.actions","causal.action_result"],"population_role":"primary_scored","sequence":10,"session_id":"73cde065-291b-46cf-b241-c0e0299a5b60","source":"harness_trace"},{"boundary":"file_observed","fields":{"action_id":"action-t2-2","after_sha256":"a020043db82bec2df47204c03e11ab40c5275139e0b122723810304d81e7050f","before_sha256":"f4482bd25089ad5c521d2d8c75d17607d5dec0582b9bb687b5716c9673546401","path":"fixture_project/checkout.py"},"id":"file-change-checkout","kind":"file_change","metric_ids":["work.changed_files"],"population_role":"primary_scored","sequence":11,"session_id":"73cde065-291b-46cf-b241-c0e0299a5b60","source":"filesystem_snapshot"},{"boundary":"displayed","fields":{"canary":"SB_SURVIVAL_V1_RESPONSE_R2_correction_Δ","role":"assistant","status":"completed","text":"## What Changed\n\n**Edit to [`checkout.py`](file:///Users/xxxxx/Repository/session-bench/artifacts/v1-expanded-preparation/live-captures/antigravity-2026-10-05-04/workspace/fixture_project/checkout.py)** (two lines changed):\n\n```diff\n- subtotal = sum(price for price, quantity in items)\n- return subtotal + 5\n+ subtotal = sum(price * quantity for price, quantity in items)\n+ delivery = 0 if subtotal >= 50 else 5\n+ return subtotal + delivery\n```\n\n1. **R1 fix**: `price` → `price * quantity` — each item's contribution is now correctly `unit_price × quantity`.\n2. **R2 fix**: Delivery is `0` when `subtotal >= 50`, otherwise `5` — conditional free delivery threshold.\n\n## Test Outcome — All 3 Passing ✅\n\n| Items | Subtotal | Delivery | Expected | Actual | ✓ |\n|---|---|---|---|---|---|\n| `[(10,2),(5,1)]` | `10×2+5×1 = 25` | `5` (< 50) | `30` | `30` | ✅ |\n| `[(25,2)]` | `25×2 = 50` | `0` (≥ 50) | `50` | `50` | ✅ |\n| `[(49,1)]` | `49×1 = 49` | `5` (< 50) | `54` | `54` | ✅ |\n\nExit code `0` — all tests pass